{
  "id": "systems-core",
  "name": "High-Integrity Systems & Core Runtime Preset",
  "version": "1.0.0",
  "description": "Engineered for low-latency runtimes, deterministic resource utilization, strict typing, and zero-allocation idioms.",
  "riskThreshold": "critical",
  "enabledDomains": [
    "architecture",
    "quality",
    "testing",
    "security",
    "documentation"
  ],
  "skills": [
    "skills/architecture/system-design",
    "skills/quality/coding-standards",
    "skills/testing/test-driven-verification",
    "skills/security/secure-development",
    "skills/documentation/architectural-decision-records"
  ],
  "policies": [
    "policies/directory-creation-policy.md",
    "policies/file-creation-policy.md",
    "policies/dependency-management-policy.md",
    "policies/change-scope-policy.md",
    "policies/testing-enforcement-policy.md",
    "policies/security-boundary-policy.md",
    "policies/documentation-synchronization-policy.md"
  ],
  "workflows": [
    "workflows/feature-development-workflow.md",
    "workflows/bug-fix-workflow.md",
    "workflows/refactoring-workflow.md",
    "workflows/release-workflow.md"
  ],
  "recommendedTargets": ["antigravity", "cursor", "claude-code", "copilot", "windsurf", "codex"]
}
